{
  "schema_version": "mrma.benchmark/v2",
  "corpus_version": "trust-influence-loopback/2.0",
  "mrma_version": "0.4.2",
  "passed": true,
  "case_count": 22,
  "false_positive_count": 0,
  "false_negative_count": 0,
  "inconclusive_count": 11,
  "request_cost": 942,
  "runtime_ms": 42680.687,
  "peak_memory_bytes": 4159457,
  "platform": {
    "python": "3.12.13",
    "implementation": "CPython",
    "operating_system": "Windows",
    "machine": "AMD64"
  },
  "cases": [
    {
      "name": "stable-no-influence",
      "expected_verdict": "NO_INFLUENCE_OBSERVED",
      "actual_verdict": "NO_INFLUENCE_OBSERVED",
      "request_cost": 60,
      "runtime_ms": 1671.938,
      "passed": true
    },
    {
      "name": "stable-body-influence",
      "expected_verdict": "INFLUENCE_DETECTED",
      "actual_verdict": "INFLUENCE_DETECTED",
      "request_cost": 60,
      "runtime_ms": 5094.253,
      "passed": true
    },
    {
      "name": "status-only-influence",
      "expected_verdict": "INFLUENCE_DETECTED",
      "actual_verdict": "INFLUENCE_DETECTED",
      "request_cost": 60,
      "runtime_ms": 1061.791,
      "passed": true
    },
    {
      "name": "custom-header-only-influence",
      "expected_verdict": "INFLUENCE_DETECTED",
      "actual_verdict": "INFLUENCE_DETECTED",
      "request_cost": 60,
      "runtime_ms": 1126.627,
      "passed": true
    },
    {
      "name": "redirect-only-influence",
      "expected_verdict": "INFLUENCE_DETECTED",
      "actual_verdict": "INFLUENCE_DETECTED",
      "request_cost": 80,
      "runtime_ms": 1333.825,
      "passed": true
    },
    {
      "name": "retry-only-influence",
      "expected_verdict": "INFLUENCE_DETECTED",
      "actual_verdict": "INFLUENCE_DETECTED",
      "request_cost": 80,
      "runtime_ms": 9212.659,
      "passed": true
    },
    {
      "name": "unstable-controls",
      "expected_verdict": "INCONCLUSIVE",
      "actual_verdict": "INCONCLUSIVE",
      "request_cost": 60,
      "runtime_ms": 8421.716,
      "passed": true
    },
    {
      "name": "cookie-contamination",
      "expected_verdict": "INCONCLUSIVE",
      "actual_verdict": "INCONCLUSIVE",
      "request_cost": 60,
      "runtime_ms": 1709.786,
      "passed": true
    },
    {
      "name": "missing-content-type",
      "expected_verdict": "INCONCLUSIVE",
      "actual_verdict": "INCONCLUSIVE",
      "request_cost": 60,
      "runtime_ms": 954.309,
      "passed": true
    },
    {
      "name": "malformed-content-type",
      "expected_verdict": "INCONCLUSIVE",
      "actual_verdict": "INCONCLUSIVE",
      "request_cost": 60,
      "runtime_ms": 1058.485,
      "passed": true
    },
    {
      "name": "equivalent-content-type-formatting",
      "expected_verdict": "NO_INFLUENCE_OBSERVED",
      "actual_verdict": "NO_INFLUENCE_OBSERVED",
      "request_cost": 60,
      "runtime_ms": 1181.86,
      "passed": true
    },
    {
      "name": "xml-encoding",
      "expected_verdict": "INFLUENCE_DETECTED",
      "actual_verdict": "INFLUENCE_DETECTED",
      "request_cost": 60,
      "runtime_ms": 5569.677,
      "passed": true
    },
    {
      "name": "binary-response",
      "expected_verdict": "NO_INFLUENCE_OBSERVED",
      "actual_verdict": "NO_INFLUENCE_OBSERVED",
      "request_cost": 60,
      "runtime_ms": 848.878,
      "passed": true
    },
    {
      "name": "truncated-body",
      "expected_verdict": "INCONCLUSIVE",
      "actual_verdict": "INCONCLUSIVE",
      "request_cost": 60,
      "runtime_ms": 1495.301,
      "passed": true
    },
    {
      "name": "connection-affinity",
      "expected_verdict": "LIMITATION_RECORDED",
      "actual_verdict": "LIMITATION_RECORDED",
      "request_cost": 60,
      "runtime_ms": 1241.686,
      "passed": true
    },
    {
      "name": "unauthorized-initial-target",
      "expected_verdict": "INCONCLUSIVE",
      "actual_verdict": "INCONCLUSIVE",
      "request_cost": 0,
      "runtime_ms": 40.018,
      "passed": true
    },
    {
      "name": "unauthorized-redirect",
      "expected_verdict": "INCONCLUSIVE",
      "actual_verdict": "INCONCLUSIVE",
      "request_cost": 1,
      "runtime_ms": 70.501,
      "passed": true
    },
    {
      "name": "budget-exhaustion",
      "expected_verdict": "INCONCLUSIVE",
      "actual_verdict": "INCONCLUSIVE",
      "request_cost": 1,
      "runtime_ms": 73.334,
      "passed": true
    },
    {
      "name": "cancellation-partial-evidence",
      "expected_verdict": "INCONCLUSIVE",
      "actual_verdict": "INCONCLUSIVE",
      "request_cost": 0,
      "runtime_ms": 40.461,
      "passed": true
    },
    {
      "name": "comparator-resource-limit",
      "expected_verdict": "INCONCLUSIVE",
      "actual_verdict": "INCONCLUSIVE",
      "request_cost": 0,
      "runtime_ms": 0.1,
      "passed": true
    },
    {
      "name": "normalization-timeout",
      "expected_verdict": "INCONCLUSIVE",
      "actual_verdict": "INCONCLUSIVE",
      "request_cost": 0,
      "runtime_ms": 1.034,
      "passed": true
    },
    {
      "name": "binary-raw-request",
      "expected_verdict": "BINARY_PRESERVED",
      "actual_verdict": "BINARY_PRESERVED",
      "request_cost": 0,
      "runtime_ms": 0.167,
      "passed": true
    }
  ]
}
